{
  "$schema": "https://json-schema.org/draft/2020-12/schema",
  "$id": "https://fdai.dev/schemas/scenario-manifest/1.3.0",
  "type": "object",
  "additionalProperties": false,
  "required": ["schema_version", "scenario_set_version", "status", "capability_packs"],
  "properties": {
    "schema_version": {"enum": ["1.2.0", "1.3.0"]},
    "scenario_set_version": {"type": "string", "pattern": "^v\\d{4}\\.\\d{2}$"},
    "status": {"enum": ["incomplete", "complete"]},
    "capability_packs": {
      "type": "object",
      "additionalProperties": false,
      "required": ["sre", "arb_change_safety", "finops", "dr", "chaos"],
      "patternProperties": {
        "^(sre|arb_change_safety|finops|dr|chaos)$": {
          "type": "object",
          "additionalProperties": false,
          "required": ["status", "scenario_ids", "conflict_spec_ids", "coverage"],
          "properties": {
            "status": {"enum": ["missing", "partial", "complete"]},
            "scenario_ids": {"type": "array", "items": {"type": "string"}, "uniqueItems": true},
            "conflict_spec_ids": {
              "description": "Frozen cross-objective conflict artifacts this pack owns, registered by their own ids so each one is directly inventoried and guarded.",
              "type": "array",
              "items": {"type": "string", "pattern": "^[a-z0-9][a-z0-9._-]{1,127}$"},
              "uniqueItems": true
            },
            "coverage": {
              "type": "object",
              "additionalProperties": false,
              "required": ["successful_full_loop", "unknown_or_deny", "cross_objective_conflict", "partial_failure_recovery", "a3e_or_non_applicability", "deterministic_replay_with_evidence"],
              "properties": {
                "successful_full_loop": {"$ref": "#/$defs/coverageEvidence"},
                "unknown_or_deny": {"$ref": "#/$defs/coverageEvidence"},
                "cross_objective_conflict": {"$ref": "#/$defs/coverageEvidence"},
                "partial_failure_recovery": {"$ref": "#/$defs/coverageEvidence"},
                "a3e_or_non_applicability": {"$ref": "#/$defs/coverageEvidence"},
                "deterministic_replay_with_evidence": {"$ref": "#/$defs/coverageEvidence"}
              }
            },
            "required_outcome": {"$ref": "#/$defs/requiredOutcome"}
          }
        }
      }
    }
  },
  "$defs": {
    "requiredOutcome": {
      "description": "Capability-specific FDAI-CONST-005 outcome that must be complete before the pack can be complete.",
      "type": "object",
      "additionalProperties": false,
      "required": ["id", "status", "evidence"],
      "properties": {
        "id": {
          "enum": [
            "recovery_and_recurrence_closure",
            "approval_conditions_and_post_change_verification",
            "realized_savings_with_reliability_valid",
            "data_integrity_and_measured_rto_rpo",
            "human_approved_injection_and_verified_recovery"
          ]
        },
        "status": {"enum": ["missing", "complete"]},
        "evidence": {"$ref": "#/$defs/coverageEvidence"},
        "gap": {"type": "string", "minLength": 1}
      },
      "allOf": [
        {
          "if": {"properties": {"status": {"const": "complete"}}},
          "then": {"properties": {"evidence": {"minItems": 1}}}
        },
        {
          "if": {"properties": {"status": {"const": "missing"}}},
          "then": {
            "required": ["gap"],
            "properties": {"evidence": {"maxItems": 0}}
          }
        }
      ]
    },
    "coverageEvidence": {
      "type": "array",
      "items": {"$ref": "#/$defs/coverageEvidenceRecord"},
      "uniqueItems": true
    },
    "coverageEvidenceRecord": {
      "type": "object",
      "additionalProperties": false,
      "required": ["scenario_id", "test_ref"],
      "properties": {
        "scenario_id": {"type": "string", "minLength": 1},
        "test_ref": {
          "type": "string",
          "pattern": "^services/core-control-plane/tests/.+\\.py::test_[A-Za-z0-9_]+$"
        }
      }
    },
    "capabilityPackV13": {
      "type": "object",
      "required": ["required_outcome"],
      "allOf": [
        {
          "if": {
            "properties": {"status": {"const": "complete"}},
            "required": ["status"]
          },
          "then": {
            "properties": {
              "required_outcome": {
                "properties": {"status": {"const": "complete"}},
                "required": ["status"]
              },
              "coverage": {
                "properties": {
                  "successful_full_loop": {"minItems": 1},
                  "unknown_or_deny": {"minItems": 1},
                  "cross_objective_conflict": {"minItems": 1},
                  "partial_failure_recovery": {"minItems": 1},
                  "a3e_or_non_applicability": {"minItems": 1},
                  "deterministic_replay_with_evidence": {"minItems": 1}
                }
              }
            }
          }
        }
      ]
    }
  },
  "allOf": [
    {
      "if": {"properties": {"schema_version": {"const": "1.3.0"}}},
      "then": {
        "properties": {
          "capability_packs": {
            "properties": {
              "sre": {
                "allOf": [
                  {"$ref": "#/$defs/capabilityPackV13"},
                  {
                    "properties": {
                      "required_outcome": {
                        "properties": {
                          "id": {"const": "recovery_and_recurrence_closure"}
                        }
                      }
                    }
                  }
                ]
              },
              "arb_change_safety": {
                "allOf": [
                  {"$ref": "#/$defs/capabilityPackV13"},
                  {
                    "properties": {
                      "required_outcome": {
                        "properties": {
                          "id": {"const": "approval_conditions_and_post_change_verification"}
                        }
                      }
                    }
                  }
                ]
              },
              "finops": {
                "allOf": [
                  {"$ref": "#/$defs/capabilityPackV13"},
                  {
                    "properties": {
                      "required_outcome": {
                        "properties": {
                          "id": {"const": "realized_savings_with_reliability_valid"}
                        }
                      }
                    }
                  }
                ]
              },
              "dr": {
                "allOf": [
                  {"$ref": "#/$defs/capabilityPackV13"},
                  {
                    "properties": {
                      "required_outcome": {
                        "properties": {
                          "id": {"const": "data_integrity_and_measured_rto_rpo"}
                        }
                      }
                    }
                  }
                ]
              },
              "chaos": {
                "allOf": [
                  {"$ref": "#/$defs/capabilityPackV13"},
                  {
                    "properties": {
                      "required_outcome": {
                        "properties": {
                          "id": {"const": "human_approved_injection_and_verified_recovery"}
                        }
                      }
                    }
                  }
                ]
              }
            }
          }
        },
        "allOf": [
          {
            "if": {
              "properties": {"status": {"const": "complete"}},
              "required": ["status"]
            },
            "then": {
              "properties": {
                "capability_packs": {
                  "properties": {
                    "sre": {"properties": {"status": {"const": "complete"}}},
                    "arb_change_safety": {
                      "properties": {"status": {"const": "complete"}}
                    },
                    "finops": {"properties": {"status": {"const": "complete"}}},
                    "dr": {"properties": {"status": {"const": "complete"}}},
                    "chaos": {"properties": {"status": {"const": "complete"}}}
                  }
                }
              }
            }
          }
        ]
      }
    }
  ]
}
