{
  "schema_version": "1.3.0",
  "scenario_set_version": "v2026.09",
  "status": "incomplete",
  "capability_packs": {
    "sre": {
      "status": "partial",
      "scenario_ids": [
        "sre.cluster-diagnostics-missing.001",
        "sre.slo-signal-source-unmapped.002",
        "sre.telemetry-retention-excessive.003"
      ],
      "conflict_spec_ids": [
        "sre.cross-objective-conflict.v2026-09"
      ],
      "required_outcome": {
        "id": "recovery_and_recurrence_closure",
        "status": "missing",
        "evidence": [],
        "gap": "No frozen scenario proves independently verified SRE recovery and recurrence closure."
      },
      "coverage": {
        "successful_full_loop": [
          {
            "scenario_id": "sre.cluster-diagnostics-missing.001",
            "test_ref": "services/core-control-plane/tests/scenarios/test_v2026_09_replay.py::test_sre_successful_full_loop_closes_only_on_independent_effect_observation"
          },
          {
            "scenario_id": "sre.cluster-diagnostics-missing.001",
            "test_ref": "services/core-control-plane/tests/scenarios/test_v2026_09_replay.py::test_sre_full_loop_fails_closed_on_deficient_effect_evidence"
          },
          {
            "scenario_id": "sre.cluster-diagnostics-missing.001",
            "test_ref": "services/core-control-plane/tests/scenarios/test_v2026_09_replay.py::test_sre_full_loop_dispatch_without_observation_is_never_success"
          }
        ],
        "unknown_or_deny": [
          {
            "scenario_id": "sre.slo-signal-source-unmapped.002",
            "test_ref": "services/core-control-plane/tests/scenarios/test_v2026_09_replay.py::test_v2026_09_scenario_replays_through_control_loop"
          }
        ],
        "cross_objective_conflict": [
          {
            "scenario_id": "sre.cluster-diagnostics-missing.001",
            "test_ref": "services/core-control-plane/tests/scenarios/test_v2026_09_replay.py::test_sre_cross_objective_conflict_reaches_governed_arbitration"
          },
          {
            "scenario_id": "sre.slo-signal-source-unmapped.002",
            "test_ref": "services/core-control-plane/tests/scenarios/test_v2026_09_replay.py::test_sre_cross_objective_conflict_reaches_governed_arbitration"
          },
          {
            "scenario_id": "sre.telemetry-retention-excessive.003",
            "test_ref": "services/core-control-plane/tests/scenarios/test_v2026_09_replay.py::test_sre_cross_objective_conflict_reaches_governed_arbitration"
          },
          {
            "scenario_id": "sre.slo-signal-source-unmapped.002",
            "test_ref": "services/core-control-plane/tests/scenarios/test_v2026_09_replay.py::test_sre_cross_objective_conflict_closes_hil_without_arbitration_authority"
          }
        ],
        "partial_failure_recovery": [
          {
            "scenario_id": "sre.cluster-diagnostics-missing.001",
            "test_ref": "services/core-control-plane/tests/scenarios/test_v2026_09_replay.py::test_sre_partial_publish_failure_closes_the_audit_and_recovers_on_retry"
          }
        ],
        "a3e_or_non_applicability": [
          {
            "scenario_id": "sre.slo-signal-source-unmapped.002",
            "test_ref": "services/core-control-plane/tests/scenarios/test_v2026_09_replay.py::test_sre_unknown_terminates_before_a3e_authority_is_applicable"
          }
        ],
        "deterministic_replay_with_evidence": [
          {
            "scenario_id": "sre.cluster-diagnostics-missing.001",
            "test_ref": "services/core-control-plane/tests/scenarios/test_v2026_09_replay.py::test_v2026_09_scenario_replays_through_control_loop"
          },
          {
            "scenario_id": "sre.slo-signal-source-unmapped.002",
            "test_ref": "services/core-control-plane/tests/scenarios/test_v2026_09_replay.py::test_v2026_09_scenario_replays_through_control_loop"
          },
          {
            "scenario_id": "sre.telemetry-retention-excessive.003",
            "test_ref": "services/core-control-plane/tests/scenarios/test_v2026_09_replay.py::test_v2026_09_scenario_replays_through_control_loop"
          },
          {
            "scenario_id": "sre.cluster-diagnostics-missing.001",
            "test_ref": "services/core-control-plane/tests/scenarios/test_v2026_09_replay.py::test_sre_cross_objective_conflict_replays_to_stable_digests"
          },
          {
            "scenario_id": "sre.slo-signal-source-unmapped.002",
            "test_ref": "services/core-control-plane/tests/scenarios/test_v2026_09_replay.py::test_sre_cross_objective_conflict_replays_to_stable_digests"
          },
          {
            "scenario_id": "sre.telemetry-retention-excessive.003",
            "test_ref": "services/core-control-plane/tests/scenarios/test_v2026_09_replay.py::test_sre_cross_objective_conflict_replays_to_stable_digests"
          }
        ]
      }
    },
    "arb_change_safety": {
      "status": "partial",
      "scenario_ids": [
        "change.drift-manual-portal-edit.003",
        "change.nsg-allow-any-inbound.002",
        "change.tag-owner-missing.001",
        "change.vm-managed-identity-missing.004",
        "change.disk-unattached-orphan-cost.005",
        "change.container-registry-signal-unmapped.006"
      ],
      "conflict_spec_ids": [
        "arb_change_safety.cross-objective-conflict.v2026-09"
      ],
      "required_outcome": {
        "id": "approval_conditions_and_post_change_verification",
        "status": "missing",
        "evidence": [],
        "gap": "No frozen scenario proves ARB approval conditions and independently observed post-change verification."
      },
      "coverage": {
        "successful_full_loop": [
          {
            "scenario_id": "change.vm-managed-identity-missing.004",
            "test_ref": "services/core-control-plane/tests/scenarios/test_v2026_09_replay.py::test_sre_successful_full_loop_closes_only_on_independent_effect_observation"
          },
          {
            "scenario_id": "change.vm-managed-identity-missing.004",
            "test_ref": "services/core-control-plane/tests/scenarios/test_v2026_09_replay.py::test_sre_full_loop_fails_closed_on_deficient_effect_evidence"
          },
          {
            "scenario_id": "change.vm-managed-identity-missing.004",
            "test_ref": "services/core-control-plane/tests/scenarios/test_v2026_09_replay.py::test_sre_full_loop_dispatch_without_observation_is_never_success"
          }
        ],
        "unknown_or_deny": [
          {
            "scenario_id": "change.container-registry-signal-unmapped.006",
            "test_ref": "services/core-control-plane/tests/scenarios/test_v2026_09_replay.py::test_v2026_09_scenario_replays_through_control_loop"
          }
        ],
        "cross_objective_conflict": [
          {
            "scenario_id": "change.vm-managed-identity-missing.004",
            "test_ref": "services/core-control-plane/tests/scenarios/test_v2026_09_replay.py::test_sre_cross_objective_conflict_reaches_governed_arbitration"
          },
          {
            "scenario_id": "change.disk-unattached-orphan-cost.005",
            "test_ref": "services/core-control-plane/tests/scenarios/test_v2026_09_replay.py::test_sre_cross_objective_conflict_reaches_governed_arbitration"
          },
          {
            "scenario_id": "change.container-registry-signal-unmapped.006",
            "test_ref": "services/core-control-plane/tests/scenarios/test_v2026_09_replay.py::test_sre_cross_objective_conflict_reaches_governed_arbitration"
          },
          {
            "scenario_id": "change.container-registry-signal-unmapped.006",
            "test_ref": "services/core-control-plane/tests/scenarios/test_v2026_09_replay.py::test_sre_cross_objective_conflict_closes_hil_without_arbitration_authority"
          }
        ],
        "partial_failure_recovery": [
          {
            "scenario_id": "change.vm-managed-identity-missing.004",
            "test_ref": "services/core-control-plane/tests/scenarios/test_v2026_09_replay.py::test_sre_partial_publish_failure_closes_the_audit_and_recovers_on_retry"
          }
        ],
        "a3e_or_non_applicability": [
          {
            "scenario_id": "change.container-registry-signal-unmapped.006",
            "test_ref": "services/core-control-plane/tests/scenarios/test_v2026_09_replay.py::test_sre_unknown_terminates_before_a3e_authority_is_applicable"
          }
        ],
        "deterministic_replay_with_evidence": [
          {
            "scenario_id": "change.drift-manual-portal-edit.003",
            "test_ref": "services/core-control-plane/tests/scenarios/test_v2026_09_replay.py::test_v2026_09_scenario_replays_through_control_loop"
          },
          {
            "scenario_id": "change.nsg-allow-any-inbound.002",
            "test_ref": "services/core-control-plane/tests/scenarios/test_v2026_09_replay.py::test_v2026_09_scenario_replays_through_control_loop"
          },
          {
            "scenario_id": "change.tag-owner-missing.001",
            "test_ref": "services/core-control-plane/tests/scenarios/test_v2026_09_replay.py::test_v2026_09_scenario_replays_through_control_loop"
          },
          {
            "scenario_id": "change.vm-managed-identity-missing.004",
            "test_ref": "services/core-control-plane/tests/scenarios/test_v2026_09_replay.py::test_v2026_09_scenario_replays_through_control_loop"
          },
          {
            "scenario_id": "change.disk-unattached-orphan-cost.005",
            "test_ref": "services/core-control-plane/tests/scenarios/test_v2026_09_replay.py::test_v2026_09_scenario_replays_through_control_loop"
          },
          {
            "scenario_id": "change.container-registry-signal-unmapped.006",
            "test_ref": "services/core-control-plane/tests/scenarios/test_v2026_09_replay.py::test_v2026_09_scenario_replays_through_control_loop"
          },